00:00.0 Host bridge: Advanced Micro Devices, Inc. [AMD/ATI] RD780 Host Bridge
	Subsystem: Advanced Micro Devices, Inc. [AMD/ATI] RD780 Host Bridge
	Control: I/O- Mem+ BusMaster+ SpecCycle- MemWINV- VGASnoop- ParErr- Stepping- SERR- FastB2B- DisINTx-
	Status: Cap+ 66MHz+ UDF- FastB2B- ParErr- DEVSEL=medium >TAbort- <TAbort- <MAbort+ >SERR- <PERR- INTx-
	Latency: 32
	Region 3: Memory at <ignored> (64-bit, non-prefetchable)
	Capabilities: <access denied>

00:02.0 PCI bridge: Advanced Micro Devices, Inc. [AMD/ATI] RX780/RD790 PCI to PCI bridge (external gfx0 port A) (prog-if 00 [Normal decode])
	Control: I/O+ Mem+ BusMaster+ SpecCycle- MemWINV- VGASnoop- ParErr- Stepping- SERR- FastB2B- DisINTx+
	Status: Cap+ 66MHz- UDF- FastB2B- ParErr- DEVSEL=fast >TAbort- <TAbort- <MAbort- >SERR- <PERR- INTx-
	Latency: 0, Cache Line Size: 4 bytes
	Interrupt: pin A routed to IRQ 24
	Bus: primary=00, secondary=01, subordinate=01, sec-latency=0
	I/O behind bridge: 0000d000-0000dfff
	Memory behind bridge: f7000000-f8ffffff
	Prefetchable memory behind bridge: 00000000b0000000-00000000cfffffff
	Secondary status: 66MHz- FastB2B- ParErr- DEVSEL=fast >TAbort- <TAbort- <MAbort+ <SERR- <PERR-
	BridgeCtl: Parity- SERR- NoISA- VGA- MAbort- >Reset- FastB2B-
		PriDiscTmr- SecDiscTmr- DiscTmrStat- DiscTmrSERREn-
	Capabilities: <access denied>
	Kernel driver in use: pcieport
	Kernel modules: shpchp

00:03.0 PCI bridge: Advanced Micro Devices, Inc. [AMD/ATI] RD790 PCI to PCI bridge (external gfx0 port B) (prog-if 00 [Normal decode])
	Control: I/O+ Mem+ BusMaster+ SpecCycle- MemWINV- VGASnoop- ParErr- Stepping- SERR- FastB2B- DisINTx+
	Status: Cap+ 66MHz- UDF- FastB2B- ParErr- DEVSEL=fast >TAbort- <TAbort- <MAbort- >SERR- <PERR- INTx-
	Latency: 0, Cache Line Size: 4 bytes
	Interrupt: pin A routed to IRQ 25
	Bus: primary=00, secondary=02, subordinate=02, sec-latency=0
	I/O behind bridge: 0000c000-0000cfff
	Memory behind bridge: f5000000-f6ffffff
	Prefetchable memory behind bridge: 0000000050000000-000000006fffffff
	Secondary status: 66MHz- FastB2B- ParErr- DEVSEL=fast >TAbort- <TAbort- <MAbort+ <SERR- <PERR-
	BridgeCtl: Parity- SERR- NoISA- VGA+ MAbort- >Reset- FastB2B-
		PriDiscTmr- SecDiscTmr- DiscTmrStat- DiscTmrSERREn-
	Capabilities: <access denied>
	Kernel driver in use: pcieport
	Kernel modules: shpchp

00:04.0 PCI bridge: Advanced Micro Devices, Inc. [AMD/ATI] RD790 PCI to PCI bridge (PCI express gpp port A) (prog-if 00 [Normal decode])
	Control: I/O+ Mem+ BusMaster+ SpecCycle- MemWINV- VGASnoop- ParErr- Stepping- SERR- FastB2B- DisINTx+
	Status: Cap+ 66MHz- UDF- FastB2B- ParErr- DEVSEL=fast >TAbort- <TAbort- <MAbort- >SERR- <PERR- INTx-
	Latency: 0, Cache Line Size: 4 bytes
	Interrupt: pin A routed to IRQ 26
	Bus: primary=00, secondary=03, subordinate=03, sec-latency=0
	I/O behind bridge: 0000b000-0000bfff
	Memory behind bridge: fda00000-fdafffff
	Prefetchable memory behind bridge: 00000000fdf00000-00000000fdffffff
	Secondary status: 66MHz- FastB2B- ParErr- DEVSEL=fast >TAbort- <TAbort- <MAbort+ <SERR- <PERR-
	BridgeCtl: Parity- SERR- NoISA- VGA- MAbort- >Reset- FastB2B-
		PriDiscTmr- SecDiscTmr- DiscTmrStat- DiscTmrSERREn-
	Capabilities: <access denied>
	Kernel driver in use: pcieport
	Kernel modules: shpchp

00:06.0 PCI bridge: Advanced Micro Devices, Inc. [AMD/ATI] RD790 PCI to PCI bridge (PCI express gpp port C) (prog-if 00 [Normal decode])
	Control: I/O+ Mem+ BusMaster+ SpecCycle- MemWINV- VGASnoop- ParErr- Stepping- SERR- FastB2B- DisINTx+
	Status: Cap+ 66MHz- UDF- FastB2B- ParErr- DEVSEL=fast >TAbort- <TAbort- <MAbort- >SERR- <PERR- INTx-
	Latency: 0, Cache Line Size: 4 bytes
	Interrupt: pin A routed to IRQ 27
	Bus: primary=00, secondary=04, subordinate=04, sec-latency=0
	I/O behind bridge: 0000a000-0000afff
	Memory behind bridge: f3000000-f4ffffff
	Prefetchable memory behind bridge: 0000000070000000-000000008fffffff
	Secondary status: 66MHz- FastB2B- ParErr- DEVSEL=fast >TAbort- <TAbort- <MAbort+ <SERR- <PERR-
	BridgeCtl: Parity- SERR- NoISA- VGA- MAbort- >Reset- FastB2B-
		PriDiscTmr- SecDiscTmr- DiscTmrStat- DiscTmrSERREn-
	Capabilities: <access denied>
	Kernel driver in use: pcieport
	Kernel modules: shpchp

00:07.0 PCI bridge: Advanced Micro Devices, Inc. [AMD/ATI] RX780/RD790 PCI to PCI bridge (PCI express gpp port D) (prog-if 00 [Normal decode])
	Control: I/O+ Mem+ BusMaster+ SpecCycle- MemWINV- VGASnoop- ParErr- Stepping- SERR- FastB2B- DisINTx+
	Status: Cap+ 66MHz- UDF- FastB2B- ParErr- DEVSEL=fast >TAbort- <TAbort- <MAbort- >SERR- <PERR- INTx-
	Latency: 0, Cache Line Size: 4 bytes
	Interrupt: pin A routed to IRQ 28
	Bus: primary=00, secondary=05, subordinate=05, sec-latency=0
	I/O behind bridge: 00009000-00009fff
	Memory behind bridge: fb000000-fcffffff
	Prefetchable memory behind bridge: 0000000030000000-000000004fffffff
	Secondary status: 66MHz- FastB2B- ParErr- DEVSEL=fast >TAbort- <TAbort- <MAbort+ <SERR- <PERR-
	BridgeCtl: Parity- SERR- NoISA- VGA- MAbort- >Reset- FastB2B-
		PriDiscTmr- SecDiscTmr- DiscTmrStat- DiscTmrSERREn-
	Capabilities: <access denied>
	Kernel driver in use: pcieport
	Kernel modules: shpchp

00:09.0 PCI bridge: Advanced Micro Devices, Inc. [AMD/ATI] RD790 PCI to PCI bridge (PCI express gpp port E) (prog-if 00 [Normal decode])
	Control: I/O+ Mem+ BusMaster+ SpecCycle- MemWINV- VGASnoop- ParErr- Stepping- SERR- FastB2B- DisINTx+
	Status: Cap+ 66MHz- UDF- FastB2B- ParErr- DEVSEL=fast >TAbort- <TAbort- <MAbort- >SERR- <PERR- INTx-
	Latency: 0, Cache Line Size: 4 bytes
	Interrupt: pin A routed to IRQ 29
	Bus: primary=00, secondary=06, subordinate=06, sec-latency=0
	I/O behind bridge: 00008000-00008fff
	Memory behind bridge: f9000000-faffffff
	Prefetchable memory behind bridge: 0000000090000000-00000000afffffff
	Secondary status: 66MHz- FastB2B- ParErr- DEVSEL=fast >TAbort- <TAbort- <MAbort+ <SERR- <PERR-
	BridgeCtl: Parity- SERR- NoISA- VGA- MAbort- >Reset- FastB2B-
		PriDiscTmr- SecDiscTmr- DiscTmrStat- DiscTmrSERREn-
	Capabilities: <access denied>
	Kernel driver in use: pcieport
	Kernel modules: shpchp

00:0a.0 PCI bridge: Advanced Micro Devices, Inc. [AMD/ATI] RD790 PCI to PCI bridge (PCI express gpp port F) (prog-if 00 [Normal decode])
	Control: I/O+ Mem+ BusMaster+ SpecCycle- MemWINV- VGASnoop- ParErr- Stepping- SERR- FastB2B- DisINTx+
	Status: Cap+ 66MHz- UDF- FastB2B- ParErr- DEVSEL=fast >TAbort- <TAbort- <MAbort- >SERR- <PERR- INTx-
	Latency: 0, Cache Line Size: 4 bytes
	Interrupt: pin A routed to IRQ 30
	Bus: primary=00, secondary=07, subordinate=07, sec-latency=0
	I/O behind bridge: 0000e000-0000efff
	Memory behind bridge: fde00000-fdefffff
	Prefetchable memory behind bridge: 00000000fdd00000-00000000fddfffff
	Secondary status: 66MHz- FastB2B- ParErr- DEVSEL=fast >TAbort- <TAbort- <MAbort- <SERR- <PERR-
	BridgeCtl: Parity- SERR- NoISA- VGA- MAbort- >Reset- FastB2B-
		PriDiscTmr- SecDiscTmr- DiscTmrStat- DiscTmrSERREn-
	Capabilities: <access denied>
	Kernel driver in use: pcieport
	Kernel modules: shpchp

00:11.0 SATA controller: Advanced Micro Devices, Inc. [AMD/ATI] SB7x0/SB8x0/SB9x0 SATA Controller [IDE mode] (prog-if 01 [AHCI 1.0])
	Subsystem: Gigabyte Technology Co., Ltd GA-MA770-DS3rev2.0 Motherboard
	Control: I/O+ Mem+ BusMaster+ SpecCycle- MemWINV- VGASnoop- ParErr- Stepping- SERR- FastB2B- DisINTx-
	Status: Cap+ 66MHz+ UDF- FastB2B- ParErr- DEVSEL=medium >TAbort- <TAbort- <MAbort- >SERR- <PERR- INTx-
	Latency: 32
	Interrupt: pin A routed to IRQ 22
	Region 0: I/O ports at ff00 [size=8]
	Region 1: I/O ports at fe00 [size=4]
	Region 2: I/O ports at fd00 [size=8]
	Region 3: I/O ports at fc00 [size=4]
	Region 4: I/O ports at fb00 [size=16]
	Region 5: Memory at fe02f000 (32-bit, non-prefetchable) [size=1K]
	Capabilities: <access denied>
	Kernel driver in use: ahci
	Kernel modules: ahci

00:12.0 USB controller: Advanced Micro Devices, Inc. [AMD/ATI] SB7x0/SB8x0/SB9x0 USB OHCI0 Controller (prog-if 10 [OHCI])
	Subsystem: Gigabyte Technology Co., Ltd SB7x0/SB8x0/SB9x0 USB OHCI0 Controller
	Control: I/O- Mem+ BusMaster+ SpecCycle- MemWINV- VGASnoop- ParErr- Stepping- SERR- FastB2B- DisINTx-
	Status: Cap- 66MHz+ UDF- FastB2B+ ParErr- DEVSEL=medium >TAbort- <TAbort- <MAbort- >SERR- <PERR- INTx-
	Latency: 32, Cache Line Size: 4 bytes
	Interrupt: pin A routed to IRQ 16
	Region 0: Memory at fe02e000 (32-bit, non-prefetchable) [size=4K]
	Kernel driver in use: ohci-pci

00:12.1 USB controller: Advanced Micro Devices, Inc. [AMD/ATI] SB7x0 USB OHCI1 Controller (prog-if 10 [OHCI])
	Subsystem: Gigabyte Technology Co., Ltd SB7x0 USB OHCI1 Controller
	Control: I/O+ Mem+ BusMaster+ SpecCycle- MemWINV- VGASnoop- ParErr- Stepping- SERR- FastB2B- DisINTx-
	Status: Cap- 66MHz+ UDF- FastB2B+ ParErr- DEVSEL=medium >TAbort- <TAbort- <MAbort- >SERR- <PERR- INTx-
	Latency: 32, Cache Line Size: 4 bytes
	Interrupt: pin A routed to IRQ 16
	Region 0: Memory at fe02d000 (32-bit, non-prefetchable) [size=4K]
	Kernel driver in use: ohci-pci

00:12.2 USB controller: Advanced Micro Devices, Inc. [AMD/ATI] SB7x0/SB8x0/SB9x0 USB EHCI Controller (prog-if 20 [EHCI])
	Subsystem: Gigabyte Technology Co., Ltd SB7x0/SB8x0/SB9x0 USB EHCI Controller
	Control: I/O- Mem+ BusMaster+ SpecCycle- MemWINV+ VGASnoop- ParErr- Stepping- SERR- FastB2B- DisINTx-
	Status: Cap+ 66MHz+ UDF- FastB2B+ ParErr- DEVSEL=medium >TAbort- <TAbort- <MAbort- >SERR- <PERR- INTx-
	Latency: 32, Cache Line Size: 4 bytes
	Interrupt: pin B routed to IRQ 17
	Region 0: Memory at fe02c000 (32-bit, non-prefetchable) [size=256]
	Capabilities: <access denied>
	Kernel driver in use: ehci-pci

00:13.0 USB controller: Advanced Micro Devices, Inc. [AMD/ATI] SB7x0/SB8x0/SB9x0 USB OHCI0 Controller (prog-if 10 [OHCI])
	Subsystem: Gigabyte Technology Co., Ltd SB7x0/SB8x0/SB9x0 USB OHCI0 Controller
	Control: I/O- Mem+ BusMaster+ SpecCycle- MemWINV- VGASnoop- ParErr- Stepping- SERR- FastB2B- DisINTx-
	Status: Cap- 66MHz+ UDF- FastB2B+ ParErr- DEVSEL=medium >TAbort- <TAbort- <MAbort- >SERR- <PERR- INTx-
	Latency: 32, Cache Line Size: 4 bytes
	Interrupt: pin A routed to IRQ 18
	Region 0: Memory at fe02b000 (32-bit, non-prefetchable) [size=4K]
	Kernel driver in use: ohci-pci

00:13.1 USB controller: Advanced Micro Devices, Inc. [AMD/ATI] SB7x0 USB OHCI1 Controller (prog-if 10 [OHCI])
	Subsystem: Gigabyte Technology Co., Ltd SB7x0 USB OHCI1 Controller
	Control: I/O+ Mem+ BusMaster+ SpecCycle- MemWINV- VGASnoop- ParErr- Stepping- SERR- FastB2B- DisINTx-
	Status: Cap- 66MHz+ UDF- FastB2B+ ParErr- DEVSEL=medium >TAbort- <TAbort- <MAbort- >SERR- <PERR- INTx-
	Latency: 32, Cache Line Size: 4 bytes
	Interrupt: pin A routed to IRQ 18
	Region 0: Memory at fe02a000 (32-bit, non-prefetchable) [size=4K]
	Kernel driver in use: ohci-pci

00:13.2 USB controller: Advanced Micro Devices, Inc. [AMD/ATI] SB7x0/SB8x0/SB9x0 USB EHCI Controller (prog-if 20 [EHCI])
	Subsystem: Gigabyte Technology Co., Ltd SB7x0/SB8x0/SB9x0 USB EHCI Controller
	Control: I/O- Mem+ BusMaster+ SpecCycle- MemWINV+ VGASnoop- ParErr- Stepping- SERR- FastB2B- DisINTx-
	Status: Cap+ 66MHz+ UDF- FastB2B+ ParErr- DEVSEL=medium >TAbort- <TAbort- <MAbort- >SERR- <PERR- INTx-
	Latency: 32, Cache Line Size: 4 bytes
	Interrupt: pin B routed to IRQ 19
	Region 0: Memory at fe029000 (32-bit, non-prefetchable) [size=256]
	Capabilities: <access denied>
	Kernel driver in use: ehci-pci

00:14.0 SMBus: Advanced Micro Devices, Inc. [AMD/ATI] SBx00 SMBus Controller (rev 3c)
	Subsystem: Gigabyte Technology Co., Ltd GA-MA770-DS3rev2.0 Motherboard
	Control: I/O+ Mem+ BusMaster- SpecCycle- MemWINV- VGASnoop- ParErr- Stepping- SERR- FastB2B- DisINTx+
	Status: Cap+ 66MHz+ UDF- FastB2B- ParErr- DEVSEL=medium >TAbort- <TAbort- <MAbort- >SERR- <PERR- INTx-
	Capabilities: <access denied>
	Kernel modules: i2c_piix4, sp5100_tco

00:14.1 IDE interface: Advanced Micro Devices, Inc. [AMD/ATI] SB7x0/SB8x0/SB9x0 IDE Controller (prog-if 8a [Master SecP PriP])
	Subsystem: Gigabyte Technology Co., Ltd SB7x0/SB8x0/SB9x0 IDE Controller
	Control: I/O+ Mem- BusMaster+ SpecCycle- MemWINV- VGASnoop- ParErr- Stepping- SERR- FastB2B- DisINTx-
	Status: Cap+ 66MHz+ UDF- FastB2B- ParErr- DEVSEL=medium >TAbort- <TAbort- <MAbort- >SERR- <PERR- INTx-
	Latency: 32
	Interrupt: pin A routed to IRQ 16
	Region 0: I/O ports at 01f0 [size=8]
	Region 1: I/O ports at 03f4
	Region 2: I/O ports at 0170 [size=8]
	Region 3: I/O ports at 0374
	Region 4: I/O ports at fa00 [size=16]
	Capabilities: <access denied>
	Kernel driver in use: pata_atiixp
	Kernel modules: pata_atiixp, pata_acpi

00:14.2 Audio device: Advanced Micro Devices, Inc. [AMD/ATI] SBx00 Azalia (Intel HDA)
	Subsystem: Gigabyte Technology Co., Ltd SBx00 Azalia (Intel HDA)
	Control: I/O- Mem+ BusMaster+ SpecCycle- MemWINV- VGASnoop- ParErr- Stepping- SERR- FastB2B- DisINTx-
	Status: Cap+ 66MHz- UDF- FastB2B- ParErr- DEVSEL=slow >TAbort- <TAbort- <MAbort- >SERR- <PERR- INTx-
	Latency: 32, Cache Line Size: 4 bytes
	Interrupt: pin A routed to IRQ 16
	Region 0: Memory at fe024000 (64-bit, non-prefetchable) [size=16K]
	Capabilities: <access denied>
	Kernel driver in use: snd_hda_intel
	Kernel modules: snd_hda_intel

00:14.3 ISA bridge: Advanced Micro Devices, Inc. [AMD/ATI] SB7x0/SB8x0/SB9x0 LPC host controller
	Subsystem: Advanced Micro Devices, Inc. [AMD/ATI] SB7x0/SB8x0/SB9x0 LPC host controller
	Control: I/O+ Mem+ BusMaster+ SpecCycle+ MemWINV- VGASnoop- ParErr- Stepping- SERR- FastB2B- DisINTx-
	Status: Cap- 66MHz+ UDF- FastB2B- ParErr- DEVSEL=medium >TAbort- <TAbort- <MAbort- >SERR- <PERR- INTx-
	Latency: 0

00:14.4 PCI bridge: Advanced Micro Devices, Inc. [AMD/ATI] SBx00 PCI to PCI Bridge (prog-if 01 [Subtractive decode])
	Control: I/O+ Mem+ BusMaster+ SpecCycle- MemWINV- VGASnoop+ ParErr- Stepping- SERR- FastB2B- DisINTx-
	Status: Cap- 66MHz+ UDF- FastB2B+ ParErr- DEVSEL=medium >TAbort- <TAbort- <MAbort- >SERR- <PERR- INTx-
	Latency: 64
	Bus: primary=00, secondary=08, subordinate=08, sec-latency=64
	I/O behind bridge: 00007000-00007fff
	Memory behind bridge: fdc00000-fdcfffff
	Prefetchable memory behind bridge: fdb00000-fdbfffff
	Secondary status: 66MHz- FastB2B+ ParErr- DEVSEL=medium >TAbort- <TAbort- <MAbort+ <SERR- <PERR-
	BridgeCtl: Parity- SERR- NoISA- VGA- MAbort- >Reset- FastB2B-
		PriDiscTmr- SecDiscTmr- DiscTmrStat- DiscTmrSERREn-

00:14.5 USB controller: Advanced Micro Devices, Inc. [AMD/ATI] SB7x0/SB8x0/SB9x0 USB OHCI2 Controller (prog-if 10 [OHCI])
	Subsystem: Gigabyte Technology Co., Ltd SB7x0/SB8x0/SB9x0 USB OHCI2 Controller
	Control: I/O- Mem+ BusMaster+ SpecCycle- MemWINV- VGASnoop- ParErr- Stepping- SERR- FastB2B- DisINTx-
	Status: Cap- 66MHz+ UDF- FastB2B+ ParErr- DEVSEL=medium >TAbort- <TAbort- <MAbort- >SERR- <PERR- INTx-
	Latency: 32, Cache Line Size: 4 bytes
	Interrupt: pin C routed to IRQ 18
	Region 0: Memory at fe028000 (32-bit, non-prefetchable) [size=4K]
	Kernel driver in use: ohci-pci

00:18.0 Host bridge: Advanced Micro Devices, Inc. [AMD] Family 10h Processor HyperTransport Configuration
	Control: I/O- Mem- BusMaster- SpecCycle- MemWINV- VGASnoop- ParErr- Stepping- SERR- FastB2B- DisINTx-
	Status: Cap+ 66MHz- UDF- FastB2B- ParErr- DEVSEL=fast >TAbort- <TAbort- <MAbort- >SERR- <PERR- INTx-
	Capabilities: <access denied>

00:18.1 Host bridge: Advanced Micro Devices, Inc. [AMD] Family 10h Processor Address Map
	Control: I/O- Mem- BusMaster- SpecCycle- MemWINV- VGASnoop- ParErr- Stepping- SERR- FastB2B- DisINTx-
	Status: Cap- 66MHz- UDF- FastB2B- ParErr- DEVSEL=fast >TAbort- <TAbort- <MAbort- >SERR- <PERR- INTx-

00:18.2 Host bridge: Advanced Micro Devices, Inc. [AMD] Family 10h Processor DRAM Controller
	Control: I/O- Mem- BusMaster- SpecCycle- MemWINV- VGASnoop- ParErr- Stepping- SERR- FastB2B- DisINTx-
	Status: Cap- 66MHz- UDF- FastB2B- ParErr- DEVSEL=fast >TAbort- <TAbort- <MAbort- >SERR- <PERR- INTx-
	Kernel modules: amd64_edac_mod

00:18.3 Host bridge: Advanced Micro Devices, Inc. [AMD] Family 10h Processor Miscellaneous Control
	Control: I/O- Mem- BusMaster- SpecCycle- MemWINV- VGASnoop- ParErr- Stepping- SERR- FastB2B- DisINTx-
	Status: Cap+ 66MHz- UDF- FastB2B- ParErr- DEVSEL=fast >TAbort- <TAbort- <MAbort- >SERR- <PERR- INTx-
	Capabilities: <access denied>
	Kernel driver in use: k10temp
	Kernel modules: k10temp

00:18.4 Host bridge: Advanced Micro Devices, Inc. [AMD] Family 10h Processor Link Control
	Control: I/O- Mem- BusMaster- SpecCycle- MemWINV- VGASnoop- ParErr- Stepping- SERR- FastB2B- DisINTx-
	Status: Cap- 66MHz- UDF- FastB2B- ParErr- DEVSEL=fast >TAbort- <TAbort- <MAbort- >SERR- <PERR- INTx-

01:00.0 VGA compatible controller: NVIDIA Corporation Device 1c03 (rev a1) (prog-if 00 [VGA controller])
	Subsystem: NVIDIA Corporation Device 11d7
	Control: I/O+ Mem+ BusMaster+ SpecCycle- MemWINV- VGASnoop- ParErr- Stepping- SERR- FastB2B- DisINTx-
	Status: Cap+ 66MHz- UDF- FastB2B- ParErr- DEVSEL=fast >TAbort- <TAbort- <MAbort- >SERR- <PERR- INTx-
	Latency: 0
	Interrupt: pin A routed to IRQ 18
	Region 0: Memory at f7000000 (32-bit, non-prefetchable) [size=16M]
	Region 1: Memory at b0000000 (64-bit, prefetchable) [size=256M]
	Region 3: Memory at ce000000 (64-bit, prefetchable) [size=32M]
	Region 5: I/O ports at df00 [size=128]
	[virtual] Expansion ROM at f8000000 [disabled] [size=512K]
	Capabilities: <access denied>
	Kernel driver in use: nvidia
	Kernel modules: nvidiafb, nouveau, nvidia_384_drm, nvidia_384

01:00.1 Audio device: NVIDIA Corporation Device 10f1 (rev a1)
	Subsystem: NVIDIA Corporation Device 11d7
	Control: I/O- Mem+ BusMaster+ SpecCycle- MemWINV- VGASnoop- ParErr- Stepping- SERR- FastB2B- DisINTx-
	Status: Cap+ 66MHz- UDF- FastB2B- ParErr- DEVSEL=fast >TAbort- <TAbort- <MAbort- >SERR- <PERR- INTx-
	Latency: 0, Cache Line Size: 4 bytes
	Interrupt: pin B routed to IRQ 19
	Region 0: Memory at f8ffc000 (32-bit, non-prefetchable) [size=16K]
	Capabilities: <access denied>
	Kernel driver in use: snd_hda_intel
	Kernel modules: snd_hda_intel

02:00.0 VGA compatible controller: NVIDIA Corporation Device 1c03 (rev a1) (prog-if 00 [VGA controller])
	Subsystem: Device 196e:119f
	Control: I/O+ Mem+ BusMaster+ SpecCycle- MemWINV- VGASnoop- ParErr- Stepping- SERR- FastB2B- DisINTx-
	Status: Cap+ 66MHz- UDF- FastB2B- ParErr- DEVSEL=fast >TAbort- <TAbort- <MAbort- >SERR- <PERR- INTx-
	Latency: 0
	Interrupt: pin A routed to IRQ 19
	Region 0: Memory at f5000000 (32-bit, non-prefetchable) [size=16M]
	Region 1: Memory at 50000000 (64-bit, prefetchable) [size=256M]
	Region 3: Memory at 6e000000 (64-bit, prefetchable) [size=32M]
	Region 5: I/O ports at cf00 [size=128]
	[virtual] Expansion ROM at f6000000 [disabled] [size=512K]
	Capabilities: <access denied>
	Kernel driver in use: nvidia
	Kernel modules: nvidiafb, nouveau, nvidia_384_drm, nvidia_384

02:00.1 Audio device: NVIDIA Corporation Device 10f1 (rev a1)
	Subsystem: Device 196e:119f
	Control: I/O- Mem+ BusMaster+ SpecCycle- MemWINV- VGASnoop- ParErr- Stepping- SERR- FastB2B- DisINTx-
	Status: Cap+ 66MHz- UDF- FastB2B- ParErr- DEVSEL=fast >TAbort- <TAbort- <MAbort- >SERR- <PERR- INTx-
	Latency: 0, Cache Line Size: 4 bytes
	Interrupt: pin B routed to IRQ 16
	Region 0: Memory at f6ffc000 (32-bit, non-prefetchable) [size=16K]
	Capabilities: <access denied>
	Kernel driver in use: snd_hda_intel
	Kernel modules: snd_hda_intel

03:00.0 SATA controller: JMicron Technology Corp. JMB363 SATA/IDE Controller (rev 02) (prog-if 01 [AHCI 1.0])
	Subsystem: Gigabyte Technology Co., Ltd Motherboard
	Control: I/O+ Mem+ BusMaster+ SpecCycle- MemWINV- VGASnoop- ParErr- Stepping- SERR- FastB2B- DisINTx-
	Status: Cap+ 66MHz- UDF- FastB2B- ParErr- DEVSEL=fast >TAbort- <TAbort- <MAbort- >SERR- <PERR- INTx-
	Latency: 0, Cache Line Size: 4 bytes
	Interrupt: pin A routed to IRQ 16
	Region 5: Memory at fdafe000 (32-bit, non-prefetchable) [size=8K]
	Capabilities: <access denied>
	Kernel driver in use: ahci
	Kernel modules: ahci

03:00.1 IDE interface: JMicron Technology Corp. JMB363 SATA/IDE Controller (rev 02) (prog-if 85 [Master SecO PriO])
	Subsystem: Gigabyte Technology Co., Ltd Motherboard
	Control: I/O+ Mem- BusMaster+ SpecCycle- MemWINV- VGASnoop- ParErr- Stepping- SERR- FastB2B- DisINTx-
	Status: Cap+ 66MHz- UDF- FastB2B- ParErr- DEVSEL=fast >TAbort- <TAbort- <MAbort- >SERR- <PERR- INTx-
	Latency: 0
	Interrupt: pin B routed to IRQ 17
	Region 0: I/O ports at bf00 [size=8]
	Region 1: I/O ports at be00 [size=4]
	Region 2: I/O ports at bd00 [size=8]
	Region 3: I/O ports at bc00 [size=4]
	Region 4: I/O ports at bb00 [size=16]
	Capabilities: <access denied>
	Kernel driver in use: pata_jmicron
	Kernel modules: pata_jmicron, pata_acpi

04:00.0 VGA compatible controller: NVIDIA Corporation Device 1c03 (rev a1) (prog-if 00 [VGA controller])
	Subsystem: NVIDIA Corporation Device 11d7
	Control: I/O+ Mem+ BusMaster+ SpecCycle- MemWINV- VGASnoop- ParErr- Stepping- SERR- FastB2B- DisINTx-
	Status: Cap+ 66MHz- UDF- FastB2B- ParErr- DEVSEL=fast >TAbort- <TAbort- <MAbort- >SERR- <PERR- INTx-
	Latency: 0
	Interrupt: pin A routed to IRQ 18
	Region 0: Memory at f3000000 (32-bit, non-prefetchable) [size=16M]
	Region 1: Memory at 70000000 (64-bit, prefetchable) [size=256M]
	Region 3: Memory at 8e000000 (64-bit, prefetchable) [size=32M]
	Region 5: I/O ports at af00 [size=128]
	[virtual] Expansion ROM at f4000000 [disabled] [size=512K]
	Capabilities: <access denied>
	Kernel driver in use: nvidia
	Kernel modules: nvidiafb, nouveau, nvidia_384_drm, nvidia_384

04:00.1 Audio device: NVIDIA Corporation Device 10f1 (rev a1)
	Subsystem: NVIDIA Corporation Device 11d7
	Control: I/O- Mem+ BusMaster+ SpecCycle- MemWINV- VGASnoop- ParErr- Stepping- SERR- FastB2B- DisINTx-
	Status: Cap+ 66MHz- UDF- FastB2B- ParErr- DEVSEL=fast >TAbort- <TAbort- <MAbort- >SERR- <PERR- INTx-
	Latency: 0, Cache Line Size: 4 bytes
	Interrupt: pin B routed to IRQ 19
	Region 0: Memory at f4ffc000 (32-bit, non-prefetchable) [size=16K]
	Capabilities: <access denied>
	Kernel driver in use: snd_hda_intel
	Kernel modules: snd_hda_intel

05:00.0 VGA compatible controller: NVIDIA Corporation Device 1c03 (rev a1) (prog-if 00 [VGA controller])
	Subsystem: Device 196e:119f
	Control: I/O- Mem+ BusMaster+ SpecCycle- MemWINV- VGASnoop- ParErr- Stepping- SERR- FastB2B- DisINTx-
	Status: Cap+ 66MHz- UDF- FastB2B- ParErr- DEVSEL=fast >TAbort- <TAbort- <MAbort- >SERR- <PERR- INTx-
	Latency: 0
	Interrupt: pin A routed to IRQ 19
	Region 0: Memory at fb000000 (32-bit, non-prefetchable) [size=16M]
	Region 1: Memory at 30000000 (64-bit, prefetchable) [size=256M]
	Region 3: Memory at 4e000000 (64-bit, prefetchable) [size=32M]
	Region 5: I/O ports at 9f00 [disabled] [size=128]
	[virtual] Expansion ROM at fc000000 [disabled] [size=512K]
	Capabilities: <access denied>
	Kernel driver in use: nvidia
	Kernel modules: nvidiafb, nouveau, nvidia_384_drm, nvidia_384

05:00.1 Audio device: NVIDIA Corporation Device 10f1 (rev a1)
	Subsystem: Device 196e:119f
	Control: I/O- Mem- BusMaster- SpecCycle- MemWINV- VGASnoop- ParErr- Stepping- SERR- FastB2B- DisINTx-
	Status: Cap+ 66MHz- UDF- FastB2B- ParErr- DEVSEL=fast >TAbort- <TAbort- <MAbort- >SERR- <PERR- INTx-
	Interrupt: pin B routed to IRQ 16
	Region 0: Memory at fcffc000 (32-bit, non-prefetchable) [disabled] [size=16K]
	Capabilities: <access denied>
	Kernel driver in use: snd_hda_intel
	Kernel modules: snd_hda_intel

06:00.0 VGA compatible controller: NVIDIA Corporation Device 1c03 (rev a1) (prog-if 00 [VGA controller])
	Subsystem: NVIDIA Corporation Device 11d7
	Control: I/O+ Mem+ BusMaster+ SpecCycle- MemWINV- VGASnoop- ParErr- Stepping- SERR- FastB2B- DisINTx-
	Status: Cap+ 66MHz- UDF- FastB2B- ParErr- DEVSEL=fast >TAbort- <TAbort- <MAbort- >SERR- <PERR- INTx-
	Latency: 0
	Interrupt: pin A routed to IRQ 17
	Region 0: Memory at f9000000 (32-bit, non-prefetchable) [size=16M]
	Region 1: Memory at 90000000 (64-bit, prefetchable) [size=256M]
	Region 3: Memory at ae000000 (64-bit, prefetchable) [size=32M]
	Region 5: I/O ports at 8f00 [size=128]
	[virtual] Expansion ROM at fa000000 [disabled] [size=512K]
	Capabilities: <access denied>
	Kernel driver in use: nvidia
	Kernel modules: nvidiafb, nouveau, nvidia_384_drm, nvidia_384

06:00.1 Audio device: NVIDIA Corporation Device 10f1 (rev a1)
	Subsystem: NVIDIA Corporation Device 11d7
	Control: I/O- Mem+ BusMaster+ SpecCycle- MemWINV- VGASnoop- ParErr- Stepping- SERR- FastB2B- DisINTx-
	Status: Cap+ 66MHz- UDF- FastB2B- ParErr- DEVSEL=fast >TAbort- <TAbort- <MAbort- >SERR- <PERR- INTx-
	Latency: 0, Cache Line Size: 4 bytes
	Interrupt: pin B routed to IRQ 18
	Region 0: Memory at faffc000 (32-bit, non-prefetchable) [size=16K]
	Capabilities: <access denied>
	Kernel driver in use: snd_hda_intel
	Kernel modules: snd_hda_intel

07:00.0 Ethernet controller: Realtek Semiconductor Co., Ltd. RTL8111/8168/8411 PCI Express Gigabit Ethernet Controller (rev 02)
	Subsystem: Gigabyte Technology Co., Ltd Motherboard
	Control: I/O+ Mem+ BusMaster+ SpecCycle- MemWINV- VGASnoop- ParErr- Stepping- SERR- FastB2B- DisINTx+
	Status: Cap+ 66MHz- UDF- FastB2B- ParErr- DEVSEL=fast >TAbort- <TAbort- <MAbort- >SERR- <PERR- INTx-
	Latency: 0, Cache Line Size: 4 bytes
	Interrupt: pin A routed to IRQ 31
	Region 0: I/O ports at ee00 [size=256]
	Region 2: Memory at fddff000 (64-bit, prefetchable) [size=4K]
	Region 4: Memory at fdde0000 (64-bit, prefetchable) [size=64K]
	[virtual] Expansion ROM at fde00000 [disabled] [size=64K]
	Capabilities: <access denied>
	Kernel driver in use: r8169
	Kernel modules: r8169

08:0e.0 FireWire (IEEE 1394): Texas Instruments TSB43AB23 IEEE-1394a-2000 Controller (PHY/Link) (prog-if 10 [OHCI])
	Subsystem: Gigabyte Technology Co., Ltd Motherboard
	Control: I/O- Mem+ BusMaster+ SpecCycle- MemWINV- VGASnoop- ParErr- Stepping- SERR- FastB2B- DisINTx-
	Status: Cap+ 66MHz- UDF- FastB2B- ParErr- DEVSEL=medium >TAbort- <TAbort- <MAbort- >SERR- <PERR- INTx-
	Latency: 32 (500ns min, 1000ns max), Cache Line Size: 4 bytes
	Interrupt: pin A routed to IRQ 22
	Region 0: Memory at fdcff000 (32-bit, non-prefetchable) [size=2K]
	Region 1: Memory at fdcf8000 (32-bit, non-prefetchable) [size=16K]
	Capabilities: <access denied>
	Kernel driver in use: firewire_ohci
	Kernel modules: firewire_ohci

